symbol,companyName,ltp,pChange,Days Since High,Today's Date,Series Type,Market Cap,P/E Ratio,ROE,ROCE,Sector,Industry,About,LATESTPRICE
GMDCLTD,Gujarat Mineral Development Corporation Limited,455.7,-0.87,43.0,04-Sep-25,Equity,14482.0,21.8,10.9,14.1,Commodities,Metals & Mining,"Gujarat Mineral Development Corporation is primarily engaged in 2 sectors i.e. mining and power.[1] Its projects include Lignite, Bauxite, Fluorspar, Multi-Metal, Manganese, Power, Wind and Solar.",613.1
GPIL,Godawari Power And Ispat limited,244.15,-1.54,266.0,04-Sep-25,Equity,16343.0,22.1,17.2,23.2,Industrials,Capital Goods,"Godawari Power & Ispat is mainly engaged in the business of Mining of Iron Ore and Manufacturing of Iron Ore Pellets, Sponge Iron, Steel Billets, Wire Rods, H.B. Wire and Ferro Alloys with generation of Electricity.",247.39
INDIACEM,The India Cements Limited,400.7,-0.76,1.0,04-Sep-25,Equity,12447.0,Book Value,8.83,5.49,Commodities,Construction Materials,"India Cements Ltd is a leading cement manufacturing company headquartered in Chennai. It was incorporated in the year 1946 by Shri S N N Sankaralinga Iyer and Sri T S Narayanaswami. While retaining cement over the years as its mainstay, India Cements has ventured into related fields like shipping, captive power and coal mining that have purposeful synergy to the core business. The co is also a sponsor of the IPL franchise “Chennai Super Kings”.",386.75
INDNIPPON,India Nippon Electricals Limited,861.0,1.77,1.0,04-Sep-25,Equity,1946.0,22.3,12.3,15.4,Consumer Discretionary,Automobile and Auto Components,"India Nippon Electricals is a manufacturer of Ignition Systems for two-wheelers, three-wheelers, and portable engines [1]
It was incorporated in 1984 and was converted into a joint venture in 1986 between Lucas Indian Service Ltd, a wholly-owned subsidiary of Lucas-TVS Ltd and MAHLE Electric Drives Japan Corporation(Japan) – a company of MAHLE Group",1046.05
INM,Interiors & More Limited,582.6,0.2,1.0,04-Sep-25,SME,407.0,34.0,19.6,21.7,Consumer Discretionary,Consumer Durables,"Incorporated in June 2012, Interiors & More Limited trades, imports, and sells artificial flowers. The company manufactures and trades quality artificial flowers, plants, and decor items for homes and offices.",638.0
JINDALPHOT,Jindal Photo Limited,1170.0,-4.26,1.0,04-Sep-25,Equity,1206.0,5.22,14.0,13.8,Financial Services,Financial Services,"Incorporated in 1986, Jindal Photo
Ltd holds Investments in the Secuirties
of Group Companies and provides
Mangement Consultancy",1102.2
JSLL,Jeena Sikho Lifecare Limited,777.0,2.46,1.0,04-Sep-25,Equity,9694.0,290,41.1,52.4,Healthcare,Healthcare,Jeena Sikho Lifecare is one of the leading ayurvedic healthcare system providers in India. The company is providing healthcare services for the last ten years.,784.15
JSWCEMENT,JSW Cement Limited,152.89,-3.95,1.0,04-Sep-25,Equity,20765.0,Book Value,4.81,4.64,Commodities,Construction Materials,"JSW Cement is a leading Indian manufacturer of green cement, known for its sustainability and use in major infrastructure projects",138.86
KAUSHALYA,Kaushalya Infrastructure Development Corporation Limited,1749.9,4.5,1.0,04-Sep-25,Equity,608.0,10.2,7.19,6.33,Consumer Discretionary,Consumer Services,"Incorporated in 1992, Kaushalya Infrastructure Development Corporation is in the business of construction contracts for Infrastructure and Hotel[1]",1155.3
KAVDEFENCE,Kavveri Defence & Wireless Technologies Limited,77.84,4.99,1.0,04-Sep-25,Equity,264.0,35.4,9.58,8.43,Telecommunication,Telecommunication,"Incorporated in 1996, Kavveri Defence & Wireless Technologies Ltd is engaged in the design and development, and manufacture
of RF products and Antennas[1]",139.99
LEMONTREE,Lemon Tree Hotels Limited,170.95,0.73,10.0,04-Sep-25,Equity,13548.0,63.0,18.4,12.7,Consumer Discretionary,Consumer Services,"Lemon Tree Hotels Ltd is largest mid-priced and the third largest overall hotel chain in India. It operate in the upscale segment and in the mid-priced sector, consisting of the upper-midscale, midscale and economy segments. It delivers differentiated yet superior service offerings, with a value-for-money proposition.",173.24
LTF,L&T Finance Limited,228.15,0.44,1.0,04-Sep-25,Equity,56926.0,21.4,10.8,8.71,Financial Services,Financial Services,"L&T Finance Ltd. is a NBFC, offering a range of financial products and services. [1]
Company has filed requisite application for necessary registration as Systemically Important Non- Deposit Accepting Core Investment Company (NBFC-CIC)",262.33
M&M,Mahindra & Mahindra Limited,3480.0,5.9,17.0,04-Sep-25,Equity,433126.0,31.6,18.0,13.9,Consumer Discretionary,Automobile and Auto Components,"Mahindra & Mahindra Ltd is one of the most diversified automobile company in India with presence across 2-wheelers, 3-wheelers, PVs, CVs, tractors & earthmovers.",3462.0
MAHASTEEL,Mahamaya Steel Industries Limited,389.95,0.8,1.0,04-Sep-25,Equity,639.0,82.5,5.01,7.15,Industrials,Capital Goods,"Incorporated in 1988, Mahamaya Steel Industries Ltd does manufacturing steel structures in the shape of Angles, Beams, Joist, Channels, Rounds, Flats, Railway sleepers, etc.",459.2
MARUTI,Maruti Suzuki India Limited,14680.0,-1.65,1.0,04-Sep-25,Equity,461162.0,31.7,15.9,21.7,Consumer Discretionary,Automobile and Auto Components,"The Company was established in 1981. A joint venture agreement was signed between the Government of India and Suzuki Motor
Corporation (SMC), Japan in 1982. The Company became a subsidiary of SMC in 2002.It is the market leader in passenger vehicle segment in India. In terms of production volume and sales, the Company is now SMC’s largest subsidiary. SMC currently holds 56.28% of its equity stake.
The principal activities of the Company are manufacturing, purchase and sale of motor vehicles, components and spare parts.",15806.0
MIRCELECTR,MIRC Electronics Limited,28.3,-3.28,22.0,04-Sep-25,Equity,803.0,Book Value,26.4,3.46,Consumer Discretionary,Consumer Durables,"Incorporated in 1981, MIRC Electronics Ltd manufactures and trades consumer electronic products[1]",25.83
MOSCHIP,Moschip Technologies Limited,225.6,17.08,210.0,04-Sep-25,Equity,4279.0,106,11.2,12.0,Information Technology,Information Technology,"Moschip Technologies Ltd is a semiconductor and system design company with a focus on Turnkey ASICs, Mixed Signal IP, semiconductor & product engineering, and IoT solutions catering to aerospace & defence, consumer electronics, automotive, medical and networking & telecommunications.",270.85
MRF,MRF Limited,149700.0,-0.56,2.0,04-Sep-25,Equity,63516.0,35.3,10.6,13.6,Consumer Discretionary,Automobile and Auto Components,Madras Rubber Factory Limited (MRF) is the parent company of the MRF Group. The Co is engaged in the business of manufacturing tyres,153195.0
MUTHOOTFIN,Muthoot Finance Limited,2834.9,1.84,17.0,04-Sep-25,Equity,113341.0,18.4,19.6,13.2,Financial Services,Financial Services,Muthoot Finance is NBFC engaged in the business of providing gold loans. The company predominately operates in Southern India[1],3167.6
NAVNETEDUL,Navneet Education Limited,153.69,-0.96,364.0,04-Sep-25,Equity,3466.0,17.2,13.2,15.2,Consumer Discretionary,"Media, Entertainment & Publication","Navneet Education Limited is primarily into manufacturing and trading of education books, reference books, technical & professional books in paper form and e-learning form, and also paper and non-paper based stationery products.",162.29
NESCO,Nesco Limited,1460.0,0.86,14.0,04-Sep-25,Equity,10251.0,26.3,15.8,21.1,Services,Services,"NESCO is engaged in the businesses of Licencing premises in IT park buildings and providing related services, licencing premises for exhibitions and providing services to the organisers, manufacturing of machines and capital equipment, and providing hospitality and catering services.(Source : 202003 Annual Report Page No:74)",1305.6
NUVOCO,Nuvoco Vistas Corporation Limited,470.1,1.64,7.0,04-Sep-25,Equity,16786.0,110,0.24,3.93,Commodities,Construction Materials,"Nuvoco Vista Corporation Ltd (NVCL), is one of the largest cement companies and concrete manufacturers in India with a consolidated capacity of 25 MMTPA. It offers a diversified range of products such as cement, Ready-mix Concrete (RMX), and modern building materials i.e. adhesives, wall putty, dry plaster, cover blocks, and more.",424.35
NYKAA,FSN E-Commerce Ventures Limited,239.75,0.86,1.0,04-Sep-25,Equity,68540.0,859,5.16,9.59,Consumer Discretionary,Consumer Services,"FSN E-commerce Ventures Ltd. (FSNEV) popularly known as ""Nykaa"" is a digitally native consumer technology platform, delivering a content-led, lifestyle retail experience to consumers. The company has a diverse portfolio of beauty, personal care, and fashion products, including owned brand products manufactured by it.",239.81
PARAGMILK,Parag Milk Foods Limited,245.88,0.35,42.0,04-Sep-25,Equity,2903.0,24.4,12.3,14.0,Fast Moving Consumer Goods,Fast Moving Consumer Goods,"Parag Milk Foods Ltd, founded in 1992 by Mr. Devendra Shah is involved in the development and promotion of 100% fresh cow’s milk and milk products under international brand names with a diverse portfolio in over 10 product categories.",282.0
PAYTM,One 97 Communications Limited,1245.5,-3.32,1.0,04-Sep-25,Equity,79239.0,Book Value,10.3,10.1,Financial Services,Financial Services,"Incorporated in 2000, One 97 Communications Ltd is India's leading digital ecosystem for consumers as well as merchants. As of March 31, 2021, the company has a 333 million+ client base and 21 million+ registered merchants to whom it offers payment services, financial services, and commerce and cloud services.",1168.0
PRIZOR,Prizor Viztech Limited,315.95,-3.02,1.0,04-Sep-25,SME,333.0,32.8,41.0,45.2,Industrials,Capital Goods,"Incorporated in 2017, Prizor Viztech Ltd is a supplier of security and surveillance solutions with a wide range of CCTV cameras[1]",313.45
RISHABH,Rishabh Instruments Limited,476.05,6.1,3.0,04-Sep-25,Equity,1824.0,47.2,3.87,5.43,Industrials,Capital Goods,"Rishabh Instruments limited, with an experience of nearly three decades is an organization that has built its core competence in manufacturing, design and development of Test and Measuring Instruments and Industrial Control Products on strong fundamentals; in terms of people, infrastructure and financials. The company provides a hands-on, value driven, professional environment considering people its most important asset.",412.95
RMDRIP,R M Drip and Sprinklers Systems Limited,750.1,1.94,7.0,04-Sep-25,Equity,1847.0,77.0,39.0,44.0,Industrials,Capital Goods,"Incorporated in 1996, R M Drip & Sprinklers Systems Ltd manufactures micro irrigation systems[1]",75.99
RNBDENIMS,R&B Denims Limited,102.97,-6.87,0.0,04-Sep-25,Equity,930.0,30.4,12.3,15.9,Consumer Discretionary,Textiles,"Incorporated in 2010, R&B Denims Ltd manufactures and sells quality Denim Textile products[1]",119.28
SAGCEM,Sagar Cements Limited,295.9,8.31,1.0,04-Sep-25,Equity,3855.0,Book Value,10.3,2.19,Commodities,Construction Materials,Sagar Cements is engaged in the business of manufacture and sale of cement.,251.45
SJS,S.J.S. Enterprises Limited,1380.9,-2.48,1.0,04-Sep-25,Equity,4298.0,34.5,18.9,22.8,Consumer Discretionary,Automobile and Auto Components,"SJS Enterprises Ltd. (SJS) is one of the leading players in the Indian decorative aesthetics industry in terms of revenue. It offers a ""design-to-delivery"" aesthetics solutions provider with the ability to design, develop and manufacture a diverse product portfolio for a wide range of customers primarily in the automotive and consumer appliance industries.",1526.5
SMARTWORKS,Smartworks Coworking Spaces Limited,542.65,1.4,1.0,04-Sep-25,Equity,6182.0,Book Value,82.0,6.97,Services,Services,"Incorporated in 2015, Smartworks Coworking Spaces Limited is engaged in the business of customized managed workspace solutions, offering fully serviced, tech-enabled office environments.",566.0
SWANDEF,Swan Defence and Heavy Industries Limited,474.9,5.0,1.0,04-Sep-25,Equity,2382.0,Book Value,46.4,5.76,Industrials,Capital Goods,"Incorporated in 1997, Swan Defence and Heavy Industries Ltd is engaged in the construction of vessels, repairs, and refits of ships and rigs and heavy engineering",
SYRMA,Syrma SGS Technology Limited,828.0,4.61,1.0,04-Sep-25,Equity,16087.0,79.7,10.2,12.4,Industrials,Capital Goods,"Incorporated in 2004, Syrma SGS Technology Limited is a Chennai-based engineering and design company engaged in electronics manufacturing services (EMS). The company provides integrated services and solutions to original equipment manufacturers (OEMs) from the initial product concept stage to volume production through concept co-creation and product realization.",828.5
TEJASCARGO,Tejas Cargo India Limited,315.0,3.3,3.0,04-Sep-25,SME,753.0,39.3,16.7,15.5,Services,Services,"Incorporated in March 2021, Tejas Cargo India Limited is a logistics company providing supply chain transportation services by road throughout India.[1]",
TERASOFT,Tera Software Limited,324.0,-3.27,44.0,04-Sep-25,Equity,408.0,36.1,8.04,11.2,Information Technology,Information Technology,"Incorporated in 1994, Tera Software Ltd is in
the business of IT & Integrated related services",488.25
TFCILTD,Tourism Finance Corporation of India Limited,340.0,1.01,1.0,04-Sep-25,Equity,3158.0,36.9,9.87,10.4,Financial Services,Financial Services,"Tourism Finance Corporation of India Ltd provides financial assistance to the tourism sector comprising hotels, resorts, restaurants, food courts, amusement parks, ropeways, multiplexes, etc.",73.96
TRAVELFOOD,Travel Food Services Limited,1322.3,3.0,1.0,04-Sep-25,Equity,17312.0,47.8,39.1,41.7,Consumer Discretionary,Consumer Services,"Incorporated in 2007, Travel Food Services Ltd provides Travel QSR and Lounge services in India and abroad.[1]",1388.8
TVSMOTOR,TVS Motor Company Limited,3426.9,0.78,1.0,04-Sep-25,Equity,163116.0,68.8,28.4,15.4,Consumer Discretionary,Automobile and Auto Components,TVS Motor Company Ltd (TVSM) is engaged in manufacturing two-wheelers and its accessories; it currently manufactures a wide range of two-wheelers and three-wheelers.,3456.1
ULTRACEMCO,UltraTech Cement Limited,12646.0,-0.68,15.0,04-Sep-25,Equity,372886.0,53.9,9.29,10.9,Commodities,Construction Materials,UltraTech Cement is engaged in the manufacturing and sale of Cement and Cement related product primarily across globe.[1],12019.0
VIAZ,Viaz Tyres Limited,76.5,3.31,1.0,04-Sep-25,SME,937.0,28.1,9.5,12.0,Consumer Discretionary,Automobile and Auto Components,"Incorporated in 2018, Viaz Tyres Ltd manufactures Tyre Tubes of vehicles[1]",75.85
VIMTALABS,Vimta Labs Limited,795.1,-2.09,1.0,04-Sep-25,Equity,3537.0,58.2,13.5,17.6,Healthcare,Healthcare,"Incorporated in 1990, Vimta Labs Ltd is a contract research and testing services provider[1]",740.15
YATHARTH,Yatharth Hospital & Trauma Care Services Limited,776.75,3.62,1.0,04-Sep-25,Equity,7406.0,52.1,10.5,13.8,Healthcare,Healthcare,"Incorporated in 2008, Yatharth Hospital and Trauma Care Services Limited is a multi-care hospitals at Noida, Greater Noida, and Noida Extension, Uttar Pradesh.",745.0
ZYDUSWELL,Zydus Wellness Limited,2439.0,4.75,1.0,04-Sep-25,Equity,15413.0,47.9,6.02,6.16,Fast Moving Consumer Goods,Fast Moving Consumer Goods,"Zydus Wellness operates as an integrated consumer Company with business encompassing the entire value chain in the development, production, marketing and distribution of health and wellness products. The product portfolio of the Company includes brands like Sugar free, Everyuth and Nutralite.(Source : 202003 Annual Report Page No: 83)",464.45
AKIKO,Akiko Global Services Limited,185.85,5.0,1.0,05-Sep-25,SME,200.0,27.1,,,Financial Services,Financial Services,"Incorporated in 2018, Akiko Global
Services Ltd works as a Channel
Partner for major Banks / NBFCs[1]",256.5
ANANDRATHI,Anand Rathi Wealth Limited,2943.0,-0.45,1.0,05-Sep-25,Equity,24433.0,76.3,45.3,56.3,Financial Services,Financial Services,"Anand Rathi Wealth Ltd was incorporated on March 22, 1995. It is an AMFI registered mutual fund distributor and is one of the leading non-bank wealth solutions firms in India, being ranked amongst the top three non-bank mutual fund distributors in the country. The company offers a wide product portfolio of wealth solutions, financial product distribution, and technology solutions to its clients.",2872.4
ANONDITA,Anondita Medicare Limited,342.0,2.17,1.0,05-Sep-25,SME,616.0,39.0,,,Fast Moving Consumer Goods,Fast Moving Consumer Goods,"Founded in March 2024, Anondita Medicare Limited manufactures flavored male condoms, with its flagship product branded as “COBRA.”[1]",388.45
APOLLO,Apollo Micro Systems Limited,302.7,-3.29,1.0,05-Sep-25,Equity,10184.0,153,10.0,14.0,Industrials,Capital Goods,"Apollo Micro Systems Ltd is a pioneer in design, development, assembly and testing of electronic and electro mechanical solutions.[1]",342.75
ARIHANTACA,Arihant Academy Limited,398.45,4.86,4.0,05-Sep-25,SME,241.0,54.2,,,Consumer Discretionary,Consumer Services,"Incorporated in 1998, Arihant Academy Ltd runs premium coaching classes in Mumbai for SSC, ICSE, CBSE, Science
& Commerce[1]",425.1
BALAJITELE,Balaji Telefilms Limited,112.0,2.59,1.0,05-Sep-25,Equity,1353.0,16.5,16.0,1.16,Consumer Discretionary,"Media, Entertainment & Publication","Incorporated in 1994, Balaji Telefilms Ltd is in the business of production of TV content, Films, event business, B2C and B2B digital content business and operates a SVOD, OTT platform, etc.",124.2
BGRENERGY,BGR Energy Systems Limited,209.87,5.0,1.0,05-Sep-25,Equity,1514.0,Book Value,,24.9,Industrials,Construction,"Incorporated in 1985, BGR Energy Systems
Ltd in the business of Supply of systems and Equipment and Turnkey Engineering project contracting",262.96
BLUESTONE,BlueStone Jewellery and Lifestyle Limited,607.5,6.87,16.0,05-Sep-25,Equity,9182.0,Book Value,,,Consumer Discretionary,Consumer Durables,,611.85
CARYSIL,CARYSIL LIMITED,960.0,7.33,81.0,05-Sep-25,Equity,2732.0,38.6,14.5,15.1,Consumer Discretionary,Consumer Durables,"Carysil is engaged in manufacturing and trading of Quartz Kitchen Sinks, Stainless Steel Kitchen Sinks, Bath Products, Tiles, Kitchen Appliances and Accessories.(Source : 201903 Annual Report Page No: 112)",879.75
CENTUM,Centum Electronics Limited,2974.0,5.56,15.0,05-Sep-25,Equity,4350.0,231,3.14,12.0,Industrials,Capital Goods,"Founded in 1993, Centum Electronics Limited is one of the largest Electronics System Design and Manufacturing (ESDM) companies in India. It offers entire spectrum of design services and manufacturing of systems, subsystems for mission critical products in Defence, Space, Aerospace, Industrial, Transportation and Medical sectors.",2459.2
COMSYN,Commercial Syn Bags Limited,154.5,1.06,1.0,05-Sep-25,Equity,614.0,29.6,12.3,12.3,Industrials,Capital Goods,"Incorporated in 1984, Commercial Syn Bags
Ltd manufactuers and exports containers and packaging materials[1]",154.16
CUMMINSIND,Cummins India Limited,3922.0,-0.35,1.0,05-Sep-25,Equity,108559.0,50.9,28.2,36.3,Industrials,Capital Goods,"Cummins India Ltd is a part of the Cummins Inc. Group USA. It designs, manufactures, distributes and services diesel and alternative fuel engines from 2.8 to 100 liters, diesel and alternative-fueled power generator sets of up to 3000 kW (3750 kVA), as well as related components and technology.",3932.7
ETERNAL,ETERNAL LIMITED,329.5,1.0,16.0,05-Sep-25,Equity,317446.0,1062,1.71,2.66,Consumer Discretionary,Consumer Services,"Incorporated in 2010, Zomato Limited is one of the leading online Food Service platforms in terms of the value of food sold. Its offerings include food delivery, dining-out services, Loyalty programs, and others.",328.45
FISCHER,Fischer Medical Ventures Limited,1120.5,2.77,1.0,05-Sep-25,Equity,7227.0,1093,0.7,1.07,Healthcare,Healthcare,"Incorporated in 1993, Fischer Chemic Ltd does trading of chemicals and machineries[1]",107.73
GCSL,Gretex Corporate Services Limited,300.0,-5.45,1.0,05-Sep-25,Equity,675.0,Book Value,0.86,2.7,Financial Services,Financial Services,"Incorporated in 2008, Gretex Corporate Services Ltd is in the business of Merchant Banking[1]",247.05
GMDCLTD,Gujarat Mineral Development Corporation Limited,508.0,11.6,1.0,05-Sep-25,Equity,16180.0,24.3,10.9,14.1,Commodities,Metals & Mining,"Gujarat Mineral Development Corporation is primarily engaged in 2 sectors i.e. mining and power.[1] Its projects include Lignite, Bauxite, Fluorspar, Multi-Metal, Manganese, Power, Wind and Solar.",613.1
HBLENGINE,HBL Engineering Limited,862.85,1.37,2.0,05-Sep-25,Equity,23847.0,69.5,20.5,26.3,Industrials,Capital Goods,"Incorporated in 1983, HBL Power System Ltd manufactures and services different types of batteries, e-mobility, and other products[1]",846.85
HLEGLAS,HLE Glascoat Limited,551.0,4.52,3.0,05-Sep-25,Equity,3750.0,66.6,10.7,12.2,Industrials,Capital Goods,HLE Glascoat Ltd is in the business of manufacturing and sales of glass lined equipment and filters and dryers equipment for various industries in the country.,466.15
INDNIPPON,India Nippon Electricals Limited,881.55,2.56,1.0,05-Sep-25,Equity,1996.0,22.8,12.3,15.4,Consumer Discretionary,Automobile and Auto Components,"India Nippon Electricals is a manufacturer of Ignition Systems for two-wheelers, three-wheelers, and portable engines [1]
It was incorporated in 1984 and was converted into a joint venture in 1986 between Lucas Indian Service Ltd, a wholly-owned subsidiary of Lucas-TVS Ltd and MAHLE Electric Drives Japan Corporation(Japan) – a company of MAHLE Group",1046.05
INM,Interiors & More Limited,590.0,1.37,1.0,05-Sep-25,SME,413.0,34.5,19.6,21.7,Consumer Discretionary,Consumer Durables,"Incorporated in June 2012, Interiors & More Limited trades, imports, and sells artificial flowers. The company manufactures and trades quality artificial flowers, plants, and decor items for homes and offices.",638.0
IZMO,IZMO Limited,749.85,5.0,8.0,05-Sep-25,Equity,1117.0,21.9,15.3,16.8,Information Technology,Information Technology,"Izmo ltd. (founded in 1995) is into the business of interactive marketing solutions. It is the World leader in Automotive Interactive Marketing Solutions.The co offers hi-tech automotive e-retailing solutions in North America, Europe, and Asia. They offer sales performance coaching, OEM-certified CRM and ILM Solutions, etc. The co. also owns the world's largest collection of Automotive Images and Animation and has a client base of some of the largest automotive retail groups in the world. Hughes Precision Manufacturing Ltd. was incorporated in 2016 for the manufacture of defense equipment. It would be a 100% wholly-owned subsidiary of IZMO Ltd shortly.",1098.7
KAVDEFENCE,Kavveri Defence & Wireless Technologies Limited,81.73,5.0,1.0,05-Sep-25,Equity,281.0,37.7,9.58,8.43,Telecommunication,Telecommunication,"Incorporated in 1996, Kavveri Defence & Wireless Technologies Ltd is engaged in the design and development, and manufacture
of RF products and Antennas[1]",139.99
LEMONTREE,Lemon Tree Hotels Limited,175.15,2.46,1.0,05-Sep-25,Equity,13905.0,64.6,18.4,12.7,Consumer Discretionary,Consumer Services,"Lemon Tree Hotels Ltd is largest mid-priced and the third largest overall hotel chain in India. It operate in the upscale segment and in the mid-priced sector, consisting of the upper-midscale, midscale and economy segments. It delivers differentiated yet superior service offerings, with a value-for-money proposition.",173.24
LTF,L&T Finance Limited,230.59,1.2,1.0,05-Sep-25,Equity,57622.0,21.7,10.8,8.71,Financial Services,Financial Services,"L&T Finance Ltd. is a NBFC, offering a range of financial products and services. [1]
Company has filed requisite application for necessary registration as Systemically Important Non- Deposit Accepting Core Investment Company (NBFC-CIC)",262.33
M&M,Mahindra & Mahindra Limited,3562.9,2.34,1.0,05-Sep-25,Equity,443048.0,32.3,18.0,13.9,Consumer Discretionary,Automobile and Auto Components,"Mahindra & Mahindra Ltd is one of the most diversified automobile company in India with presence across 2-wheelers, 3-wheelers, PVs, CVs, tractors & earthmovers.",3462.0
MAHASTEEL,Mahamaya Steel Industries Limited,384.0,-1.37,1.0,05-Sep-25,Equity,645.0,83.2,5.01,7.15,Industrials,Capital Goods,"Incorporated in 1988, Mahamaya Steel Industries Ltd does manufacturing steel structures in the shape of Angles, Beams, Joist, Channels, Rounds, Flats, Railway sleepers, etc.",459.2
MOSCHIP,Moschip Technologies Limited,252.99,13.97,1.0,05-Sep-25,Equity,4739.0,117,11.2,12.0,Information Technology,Information Technology,"Moschip Technologies Ltd is a semiconductor and system design company with a focus on Turnkey ASICs, Mixed Signal IP, semiconductor & product engineering, and IoT solutions catering to aerospace & defence, consumer electronics, automotive, medical and networking & telecommunications.",270.85
MUTHOOTFIN,Muthoot Finance Limited,2830.1,0.13,1.0,05-Sep-25,Equity,113610.0,18.5,19.6,13.2,Financial Services,Financial Services,Muthoot Finance is NBFC engaged in the business of providing gold loans. The company predominately operates in Southern India[1],3167.6
NYKAA,FSN E-Commerce Ventures Limited,243.0,1.45,1.0,05-Sep-25,Equity,69594.0,873,5.16,9.59,Consumer Discretionary,Consumer Services,"FSN E-commerce Ventures Ltd. (FSNEV) popularly known as ""Nykaa"" is a digitally native consumer technology platform, delivering a content-led, lifestyle retail experience to consumers. The company has a diverse portfolio of beauty, personal care, and fashion products, including owned brand products manufactured by it.",239.81
PANSARI,Pansari Developers Limited,269.95,-1.87,4.0,05-Sep-25,Equity,470.0,62.7,5.75,6.38,Consumer Discretionary,Realty,"Incorporated in 1996, Pansari Developers Ltd is in the business of construction and real estate development of residential and commercial projects[1]",257.8
