symbol,companyName,ltp,pChange,Days Since High,Today's Date,Series Type,Market Cap,P/E Ratio,ROE,ROCE,Sector,Industry,About,LATESTPRICE
HYUNDAI,Hyundai Motor India Limited,2710.0,2.23,1.0,18-Sep-25,Equity,221030.0,40.0,41.8,53.9,Consumer Discretionary,Automobile and Auto Components,"Incorporated in May 1996, Hyundai Motor India Limited is a part of the Hyundai Motor Group, which is the third largest auto original equipment manufacturer in the world based on passenger vehicle sales.[1]",2507.6
IMFA,Indian Metals & Ferro Alloys Limited,1094.0,4.69,6.0,18-Sep-25,Equity,5818.0,16.2,17.0,21.3,Commodities,Metals & Mining,"Indian Metals and Ferro Alloys Limited (IMFA) is a leading, fully integrated producer of Ferro Chrome in India which is primarily used in the production of stainless steel. It was set up in 1961. [1]",1170.3
INDNIPPON,India Nippon Electricals Limited,982.05,-1.96,1.0,18-Sep-25,Equity,2217.0,25.4,12.3,15.4,Consumer Discretionary,Automobile and Auto Components,"India Nippon Electricals is a manufacturer of Ignition Systems for two-wheelers, three-wheelers, and portable engines [1]
It was incorporated in 1984 and was converted into a joint venture in 1986 between Lucas Indian Service Ltd, a wholly-owned subsidiary of Lucas-TVS Ltd and MAHLE Electric Drives Japan Corporation(Japan) – a company of MAHLE Group",1046.05
IZMO,IZMO Limited,1006.55,5.0,1.0,18-Sep-25,Equity,1489.0,29.2,7.03,7.98,Information Technology,Information Technology,"Izmo ltd. (founded in 1995) is into the business of interactive marketing solutions. It is the World leader in Automotive Interactive Marketing Solutions.[1]The co offers hi-tech automotive e-retailing solutions in North America, Europe, and Asia. They offer sales performance coaching, OEM-certified CRM and ILM Solutions, etc. The co. also owns the world's largest collection of Automotive Images and Animation and has a client base of some of the largest automotive retail groups in the world. Hughes Precision Manufacturing Ltd. was incorporated in 2016 for the manufacture of defense equipment. It would be a 100% wholly-owned subsidiary of IZMO Ltd shortly.",1098.7
JAKHARIA,JAKHARIA FABRIC LIMITED,123.5,4.97,3.0,18-Sep-25,SME,502.0,15.4,15.9,18.1,Consumer Discretionary,Textiles,"Incorporated in 2007, Jakharia Fabric Ltd is a manufacturer of textile products including Job work[1]",157.5
JAYNECOIND,Jayaswal Neco Industries Limited,73.76,3.16,1.0,18-Sep-25,Equity,7170.0,Book Value,0.87,2.93,Industrials,Capital Goods,"Jayaswal Neco Industries Limited (JNIL) is the flagship company of NECO Group of Industries. Started in 1976 as a small-scale Iron Foundry unit, Jayaswal Neco Industries Limited (Foundry Division) is now a producer of Iron & steel castings. The Company is engaged in the manufacturing and supply of billets, rolled products, pig iron & skull, sponge iron, pellet, steel, and Iron & steel castings.",72.09
JSWSTEEL,JSW Steel Limited,1120.8,0.88,1.0,18-Sep-25,Equity,274123.0,53.7,4.94,8.11,Commodities,Metals & Mining,"JSW Steel is primarily engaged in the business of manufacture and sale of Iron and Steel Products.[1]
It is the flagship business of the diversified, US$ 23 billion JSW Group.The Group has interests in energy, infrastructure, cement, paints, sports, and venture capital.[2]",1161.7
KAVDEFENCE,Kavveri Defence & Wireless Technologies Limited,108.06,4.99,1.0,18-Sep-25,Equity,371.0,49.7,9.58,8.43,Telecommunication,Telecommunication,"Incorporated in 1996, Kavveri Defence & Wireless Technologies Ltd is engaged in the design and development, and manufacture
of RF products and Antennas[1]",139.99
KMEW,Knowledge Marine & Engineering Works Limited,2487.2,2.17,1.0,18-Sep-25,Equity,2698.0,52.8,25.9,24.7,Services,Services,"Incorporated in 2015, Knowledge Marine & Engineering Works Ltd provides dredging services, owning and operating marine craft, and repairing, maintaining and refitting marine crafts and marine infrastructure[1]",2350.3
LAURUSLABS,Laurus Labs Limited,926.0,3.59,50.0,18-Sep-25,Equity,49864.0,98.0,7.45,9.15,Healthcare,Healthcare,"Founded in 2005, Laurus Labs is a research-driven pharmaceutical and biotechnology company having a global leadership
position in select Active Pharmaceutical Ingredients (APIs) including anti-retroviral, oncology drugs (incl High Potent APIs), Cardiovascular, and Gastro therapeutics. They also offer integrated CMO and CDMO services to Global Innovators from Clinical phase drug development to commercial manufacturing.
Laurus employs 6500+ people, including around 1050+ scientists at more than 11 facilities approved by global agencies USFDA, WHO-Geneva, Japan-PDMA, UK-MHRA, EMA, TGA etc.",864.4
LEMERITE,Le Merite Exports Limited,388.5,5.82,6.0,18-Sep-25,SME,941.0,154,5.87,8.84,Consumer Discretionary,Textiles,"Incorporated in 2003, Le Merite Exports Ltd is in the business of manufacturing, purchase and sale of textiles[1]",449.45
LTF,L&T Finance Limited,247.52,1.91,1.0,18-Sep-25,Equity,61849.0,23.3,10.8,8.71,Financial Services,Financial Services,"L&T Finance Ltd. is a NBFC, offering a range of financial products and services. [1]
Company has filed requisite application for necessary registration as Systemically Important Non- Deposit Accepting Core Investment Company (NBFC-CIC)[2]",262.33
MARUTI,Maruti Suzuki India Limited,15840.0,0.25,1.0,18-Sep-25,Equity,497313.0,34.2,15.9,21.7,Consumer Discretionary,Automobile and Auto Components,"The Company was established in 1981. A joint venture agreement was signed between the Government of India and Suzuki Motor
Corporation (SMC), Japan in 1982. The Company became a subsidiary of SMC in 2002.It is the market leader in passenger vehicle segment in India. In terms of production volume and sales, the Company is now SMC’s largest subsidiary. SMC currently holds 56.28% of its equity stake.
The principal activities of the Company are manufacturing, purchase and sale of motor vehicles, components and spare parts.",15806.0
MWL,Mangalam Worldwide Limited,251.2,2.87,0.0,18-Sep-25,Equity,757.0,23.8,12.7,13.9,Commodities,Metals & Mining,"Incorporated in 1995, Mangalam Worldwide Ltd manufactures and trades steel products and other merchandise. It also provides consultancy service[1]",236.04
NRVANDANA,N R Vandana Tex Industries Limited,52.4,-3.05,1.0,18-Sep-25,SME,122.0,14.2,26.1,18.8,Consumer Discretionary,Textiles,"Incorporated in 1992, N R Vandana Tex Industries Limited is a Kolkata-based company specializing in the design, manufacturing, and wholesale distribution of cotton textile products.[1]",53.55
OLIL,Oneclick Logistics India Limited,269.5,2.12,2.0,18-Sep-25,SME,965.0,45.5,,,Services,Services,"Incorporated in 2022, Oneclick Logistics Ltd provides clearing and forwarding services[1]",277.85
PARIN,Parin Enterprises Limited,518.15,4.99,1.0,18-Sep-25,SME,566.0,81.8,11.4,11.7,Consumer Discretionary,Consumer Durables,"Incorporated in 1983, Parin Enterprises Ltd is in the business of manufacturing and selling different categories of furniture[1]",530.35
PASHUPATI,Pashupati Cotspin Limited,729.95,2.18,2.0,18-Sep-25,Equity,1110.0,78.7,10.3,11.4,Consumer Discretionary,Textiles,"Incorporated in 2017, Pashupati Cotspin
Ltd Cotton does ginning, manufacture
and processing of yarn[1]",711.15
POONAWALLA,Poonawalla Fincorp Limited,502.3,12.35,76.0,18-Sep-25,Equity,39072.0,Book Value,1.28,4.77,Financial Services,Financial Services,"Poonawalla Fincorp Limited (erstwhile Magma Fincorp Limited) is a non-deposit taking NBFC registered with RBI. It is engaged in providing consumer and MSME financing, as well as General Insurance services. [1][2]",524.4
PROZONER,Prozone Realty Limited,48.4,-1.83,1.0,18-Sep-25,Equity,735.0,Book Value,7.85,2.83,Consumer Discretionary,Realty,"Incorporated in 2007, Prozone Realty Ltd is in the business of developing, owning and operating of Shopping Malls, Commercial and Residential Premises and providing related management consultancy services[1]",66.04
QPOWER,Quality Power Electrical Equipments Limited,983.5,-0.41,1.0,18-Sep-25,Equity,7650.0,109,22.1,26.6,Industrials,Capital Goods,"Incorporated in 2001, Quality Power Electrical Equipments Limited is engaged in the business of energy transition equipment and power technologies.[1]",1038.9
RADICO,Radico Khaitan Limited,3010.0,-0.03,2.0,18-Sep-25,Equity,40322.0,99.8,13.3,16.0,Fast Moving Consumer Goods,Fast Moving Consumer Goods,"Incorporated in the year 1943, Radico Khaitan is one of the most recognised IMFL (Indian Made Foreign Liquor) brands in India. [1]
The company was initially known as Rampur Distillery Company and was focussed on distillation and bottling for branded players and canteen stores of armed forces.",2957.6
RAMCOSYS,Ramco Systems Limited,548.9,4.99,288.0,18-Sep-25,Equity,2051.0,Book Value,10.9,5.4,Information Technology,Information Technology,"Incorporated in 1997, Ramco Systems
Ltd develops ERP Software solutions,
and provides that with related solutions
and services[1]",520.35
RELTD,Ravindra Energy Limited,178.8,-1.35,1.0,18-Sep-25,Equity,3199.0,60.6,10.8,9.53,Industrials,Capital Goods,"Incorporated in 1980, Ravindra Energy Ltd is in the business of selling Solar Pumps, setting up Solar Generation Power Plant (Ground Mount & Rooftop) & generation and sale of Power[1]",165.78
RMDRIP,R M Drip and Sprinklers Systems Limited,788.0,0.44,2.0,18-Sep-25,Equity,1958.0,81.6,39.8,44.0,Industrials,Capital Goods,"Incorporated in 1996, R M Drip & Sprinklers Systems Ltd manufactures micro irrigation systems[1]",75.99
SEJALLTD,Sejal Glass Limited,786.85,5.0,1.0,18-Sep-25,Equity,790.0,56.6,32.6,13.6,Industrials,Capital Goods,"Incorporated in 1998, Sejal Glass Ltd is in the business of value addition of glass & glass products[1]",774.9
SGMART,SG Mart Limited,383.0,1.71,1.0,18-Sep-25,Equity,4844.0,44.3,9.01,11.3,Commodities,Metals & Mining,"SG Mart offers a wide range of products with 27+ product categories, and 2500+ SKUs. These categories include steel construction products like TMT Rebars, HR Sheet, Welding rod, Binding wire, mesh net, tapping screw and barbed wire, tiles, cement, bath fittings, laminates and paints. [1]",365.0
SHRIAHIMSA,Shri Ahimsa Naturals Limited,242.0,-1.1,1.0,18-Sep-25,SME,564.0,25.6,18.5,24.3,Fast Moving Consumer Goods,Fast Moving Consumer Goods,"Incorporated in 1990, Shri Ahimsa Naturals Limited extracts and manufactures Caffeine Anhydrous, Green Coffee Bean Extracts, and Crude Caffeine, also trading other herbal extracts.[1]",225.75
SIRCA,Sirca Paints India Limited,490.0,0.65,9.0,18-Sep-25,Equity,2677.0,50.5,14.9,19.7,Consumer Discretionary,Consumer Durables,"Sirca Paints India Ltd is engaged in the business of manufacturing, selling and export of wood coatings and other decorative paints under the brand ‘Sirca’. [1]",490.8
SRM,SRM Contractors Limited,539.8,-2.18,1.0,18-Sep-25,Equity,1230.0,19.5,27.2,33.2,Industrials,Construction,"Incorporated in 2008, SRM Contractors Ltd
is engaged in construction of roads including bridges, tunnel works, and slope stabilisation works[1]",554.25
STLNETWORK,STL Networks Limited,30.31,19.99,1.0,18-Sep-25,Equity,1479.0,Book Value,,,Telecommunication,Telecommunication,,29.4
TERASOFT,Tera Software Limited,435.55,0.0,1.0,18-Sep-25,Equity,535.0,47.3,8.04,11.3,Information Technology,Information Technology,"Incorporated in 1994, Tera Software Ltd is in
the business of IT & Integrated related services",488.25
VIESL,Vision Infra Equipment Solutions Limited,234.25,7.04,272.0,18-Sep-25,SME,581.0,18.7,33.1,19.6,Services,Services,"Incorporated in 2015, Vision Infra Equipment Solutions Ltd is in the business of leasing, renting, refurbishing,
and selling road construction equipment
and other types of construction machinery.
It also manages work contracts, projected crushing, soil stabilization, recycling, milling, and paving",231.65
ZYDUSWELL,Zydus Wellness Limited,516.0,0.08,1.0,18-Sep-25,Equity,16567.0,51.5,6.02,6.16,Fast Moving Consumer Goods,Fast Moving Consumer Goods,"Zydus Wellness operates as an integrated consumer Company with business encompassing the entire value chain in the development, production, marketing and distribution of health and wellness products. The product portfolio of the Company includes brands like Sugar free, Everyuth and Nutralite.(Source : 202003 Annual Report Page No: 83)",464.45
ADANIPOWER,Adani Power Limited,716.1,13.42,360.0,19-Sep-25,Equity,273693.0,22.0,26.1,22.5,Utilities,Power,"Adani Power (APL), a part of the diversified Adani Group, is the largest private thermal power producer in India. The co along with its subsidiaries sell power generated from these projects under a combination of long term Power Purchase Agreements, Short term PPA and on merchant basis. [1][2]",147.38
AFFLE,Affle 3i Limited,2143.0,1.81,2.0,19-Sep-25,Equity,30196.0,75.3,14.0,16.8,Information Technology,Information Technology,"Incorporated in 1994, Affle is a global technology company with a proprietary consumer intelligence platform that transforms ads into recommendations helping marketers to effectively identify, engage, acquire and drive transactions with their potential and existing users[1]",1938.6
ARFIN,Arfin India Limited,46.4,3.0,1.0,19-Sep-25,Equity,777.0,84.9,7.23,14.0,Commodities,Metals & Mining,"Incorporated in 1992, Arfin India Ltd manufactures and trades non-ferrous
metals[1]",47.54
ASHOKLEY,Ashok Leyland Limited,141.05,1.65,1.0,19-Sep-25,Equity,82817.0,25.9,28.8,14.3,Industrials,Capital Goods,"Ashok Leyland is the flagship Company of the Hinduja group, having a long-standing presence in the domestic medium and heavy commercial vehicle (M&HCV) segment. The company has a strong brand and well-diversified distribution and service network across the country and has a presence in 50 countries, it is one of the most fully-integrated manufacturing companies. Its headquarter is in Chennai
They manage driver training institutes across India and have trained over 8,00,000 drivers since inception.",139.79
AXISCADES,AXISCADES Technologies Limited,1692.8,0.98,2.0,19-Sep-25,Equity,7168.0,87.7,12.7,13.8,Industrials,Capital Goods,Axiscades Technologies Limited is a technology solutions company focussing on engineering solutions and services. [1],1706.2
BAFNAPH,Bafna Pharmaceuticals Limited,138.19,5.0,1.0,19-Sep-25,Equity,327.0,Book Value,6.18,3.0,Healthcare,Healthcare,"Incorporated in 1981, Bafna Pharmaceuticals
Ltd manufactures finished pharmaceutical formulations[1]",169.26
BALAJITELE,Balaji Telefilms Limited,124.7,2.03,1.0,19-Sep-25,Equity,1487.0,18.1,15.8,1.35,Consumer Discretionary,"Media, Entertainment & Publication","Incorporated in 1994, Balaji Telefilms Ltd is in the business of production of TV content, Films, event business, B2C and B2B digital content business and operates a SVOD, OTT platform, etc.[1]",124.2
BANCOINDIA,Banco Products (I) Limited,829.7,3.42,1.0,19-Sep-25,Equity,11988.0,27.7,32.2,32.4,Consumer Discretionary,Automobile and Auto Components,"Banco Products (India) Ltd manufactures and supplies engine cooling modules and systems for automotive and industrial applications in both the domestic and international markets. It was Incorporated in 1961, promoted by Mr. Mehul K. Patel who has more than 40 years of experience in the automotive industry [1]",847.95
BELRISE,Belrise Industries Limited,157.08,1.75,1.0,19-Sep-25,Equity,13974.0,35.3,14.1,14.3,Consumer Discretionary,Automobile and Auto Components,"Incorporated in 1988, Belrise Industries Limited manufactures Automotive Sheet Metal and casting parts, Polymer components, Suspension, and mirror systems for automotives.[1]",163.02
COOLCAPS,Cool Caps Industries Limited,103.05,7.68,4.0,19-Sep-25,SME,1193.0,98.9,24.7,15.8,Industrials,Capital Goods,"Incorporated in 2015, Cool Caps Industries manufactures Plastic Caps & Closures[1]",90.5
CPEDU,Career Point Edutech Limited,292.2,9.54,9.0,19-Sep-25,Equity,531.0,28.4,39.1,48.3,Consumer Discretionary,Consumer Services,,280.3
CUPID,Cupid Limited,214.5,3.57,2.0,19-Sep-25,Equity,5769.0,121,12.9,17.1,Fast Moving Consumer Goods,Fast Moving Consumer Goods,"Established in 1993, CUPID Limited is India's premier manufacturer of male and female condoms, personal lubricant, and IVD kits.[1]",214.73
DENTA,Denta Water and Infra Solutions Limited,458.0,-1.34,1.0,19-Sep-25,Equity,1246.0,21.4,18.4,25.2,Utilities,Utilities,"Incorporated in 2016, Denta Water and
Infra Solutions Ltd is in the business of
GWR (Water Management), Irrigation,
O&M pertaining to water projects[1]",444.55
EICHERMOT,Eicher Motors Limited,6980.5,0.81,3.0,19-Sep-25,Equity,190974.0,39.5,24.1,29.8,Consumer Discretionary,Automobile and Auto Components,"Eicher Motors Limited, incorporated in 1982, is the listed company of the Eicher Group in India and a leading player in the Indian automobile industry and the global leader in middleweight motorcycles.
Eicher has a joint venture with Sweden’s AB Volvo to create Volvo Eicher Commercial Vehicles Limited (VECV). VECV is engaged in truck and bus operations, auto components business, and technical consulting services business",6941.0
ETERNAL,ETERNAL LIMITED,337.65,-0.06,1.0,19-Sep-25,Equity,324734.0,1086,1.71,2.66,Consumer Discretionary,Consumer Services,"Incorporated in 2010, Zomato Limited is one of the leading online Food Service platforms in terms of the value of food sold. Its offerings include food delivery, dining-out services, Loyalty programs, and others.
As of December 31, 2020, Zomato has established a strong footprint across 23 countries with 131,233 active food delivery restaurants, 161,637 active delivery partners, and an average monthly food order of 10.7 million customers.",328.45
GAYAHWS,Gayatri Highways Limited,2.83,4.81,1.0,19-Sep-25,Equity,678.0,9.13,,2.97,Services,Services,"Incorporated in 2006, Gayatri Highways Ltd is in the business of construction and investment[1]",4.33
GICL,Globe International Carriers Limited,147.0,5.3,1.0,19-Sep-25,SME,410.0,85.5,8.51,11.2,Services,Services,"Incorporated in 2010, Globe International
Carriers Ltd. is an end-to-end transportation
and logistic service provider[1]",163.2
GMDCLTD,Gujarat Mineral Development Corporation Limited,572.0,3.61,4.0,19-Sep-25,Equity,18195.0,27.3,10.9,14.1,Commodities,Metals & Mining,"Gujarat Mineral Development Corporation is primarily engaged in 2 sectors i.e. mining and power.[1] Its projects include Lignite, Bauxite, Fluorspar, Multi-Metal, Manganese, Power, Wind and Solar.[2]",613.1
GVT&D,GE Vernova T&D India Limited,3046.0,2.01,2.0,19-Sep-25,Equity,78734.0,422,,,Industrials,Capital Goods,GE T&D is the listed entity of GE’s Grid Solutions business in India. It has been in the power transmission and distribution business for more than 100 years and provides a versatile range of solutions for connecting and evacuating power from generation sources onto the grid. [1],3170.1
HYUNDAI,Hyundai Motor India Limited,2785.0,2.36,1.0,19-Sep-25,Equity,228105.0,41.3,41.8,53.9,Consumer Discretionary,Automobile and Auto Components,"Incorporated in May 1996, Hyundai Motor India Limited is a part of the Hyundai Motor Group, which is the third largest auto original equipment manufacturer in the world based on passenger vehicle sales.[1]",2507.6
IMFA,Indian Metals & Ferro Alloys Limited,1068.0,-1.81,1.0,19-Sep-25,Equity,5787.0,16.2,17.0,21.3,Commodities,Metals & Mining,"Indian Metals and Ferro Alloys Limited (IMFA) is a leading, fully integrated producer of Ferro Chrome in India which is primarily used in the production of stainless steel. It was set up in 1961. [1]",1170.3
INM,Interiors & More Limited,621.0,3.49,2.0,19-Sep-25,SME,434.0,36.3,19.6,21.7,Consumer Discretionary,Consumer Durables,"Incorporated in June 2012, Interiors & More Limited trades, imports, and sells artificial flowers. The company manufactures and trades quality artificial flowers, plants, and decor items for homes and offices.[1]",638.0
IOLCP,IOL Chemicals and Pharmaceuticals Limited,119.3,0.38,4.0,19-Sep-25,Equity,3518.0,33.5,6.13,8.87,Healthcare,Healthcare,"IOL Chemicals & Pharmaceuticals Ltd is a leading pharmaceutical (APIs) company and is a significant player in the specialty chemicals space. It serves the domestic and export market.[1]
It is the largest player of Ibuprofen (pain killer) globally with a world market share of 35%.[2]",105.66
IZMO,IZMO Limited,1056.85,5.0,1.0,19-Sep-25,Equity,1574.0,30.9,7.03,7.98,Information Technology,Information Technology,"Izmo ltd. (founded in 1995) is into the business of interactive marketing solutions. It is the World leader in Automotive Interactive Marketing Solutions.[1]The co offers hi-tech automotive e-retailing solutions in North America, Europe, and Asia. They offer sales performance coaching, OEM-certified CRM and ILM Solutions, etc. The co. also owns the world's largest collection of Automotive Images and Animation and has a client base of some of the largest automotive retail groups in the world. Hughes Precision Manufacturing Ltd. was incorporated in 2016 for the manufacture of defense equipment. It would be a 100% wholly-owned subsidiary of IZMO Ltd shortly.",1098.7
JAKHARIA,JAKHARIA FABRIC LIMITED,123.5,0.0,1.0,19-Sep-25,SME,502.0,15.4,15.9,18.1,Consumer Discretionary,Textiles,"Incorporated in 2007, Jakharia Fabric Ltd is a manufacturer of textile products including Job work[1]",157.5
JSWSTEEL,JSW Steel Limited,1125.5,0.39,1.0,19-Sep-25,Equity,274649.0,53.8,4.94,8.11,Commodities,Metals & Mining,"JSW Steel is primarily engaged in the business of manufacture and sale of Iron and Steel Products.[1]
It is the flagship business of the diversified, US$ 23 billion JSW Group.The Group has interests in energy, infrastructure, cement, paints, sports, and venture capital.[2]",1161.7
KAVDEFENCE,Kavveri Defence & Wireless Technologies Limited,109.0,0.87,1.0,19-Sep-25,Equity,374.0,50.1,9.58,8.43,Telecommunication,Telecommunication,"Incorporated in 1996, Kavveri Defence & Wireless Technologies Ltd is engaged in the design and development, and manufacture
of RF products and Antennas[1]",139.99
LAURUSLABS,Laurus Labs Limited,930.0,0.73,1.0,19-Sep-25,Equity,50401.0,99.0,7.45,9.15,Healthcare,Healthcare,"Founded in 2005, Laurus Labs is a research-driven pharmaceutical and biotechnology company having a global leadership
position in select Active Pharmaceutical Ingredients (APIs) including anti-retroviral, oncology drugs (incl High Potent APIs), Cardiovascular, and Gastro therapeutics. They also offer integrated CMO and CDMO services to Global Innovators from Clinical phase drug development to commercial manufacturing.
Laurus employs 6500+ people, including around 1050+ scientists at more than 11 facilities approved by global agencies USFDA, WHO-Geneva, Japan-PDMA, UK-MHRA, EMA, TGA etc.",864.4
LEMERITE,Le Merite Exports Limited,395.5,2.13,1.0,19-Sep-25,SME,959.0,157,5.87,8.84,Consumer Discretionary,Textiles,"Incorporated in 2003, Le Merite Exports Ltd is in the business of manufacturing, purchase and sale of textiles[1]",449.45
MARUTI,Maruti Suzuki India Limited,15880.0,0.4,1.0,19-Sep-25,Equity,499219.0,34.4,15.9,21.7,Consumer Discretionary,Automobile and Auto Components,"The Company was established in 1981. A joint venture agreement was signed between the Government of India and Suzuki Motor
Corporation (SMC), Japan in 1982. The Company became a subsidiary of SMC in 2002.It is the market leader in passenger vehicle segment in India. In terms of production volume and sales, the Company is now SMC’s largest subsidiary. SMC currently holds 56.28% of its equity stake.
The principal activities of the Company are manufacturing, purchase and sale of motor vehicles, components and spare parts.",15806.0
OLIL,Oneclick Logistics India Limited,273.0,1.92,1.0,19-Sep-25,SME,984.0,46.4,,,Services,Services,"Incorporated in 2022, Oneclick Logistics Ltd provides clearing and forwarding services[1]",277.85
PRAMARA,Pramara Promotions Limited,275.0,3.38,7.0,19-Sep-25,SME,250.0,42.4,12.4,15.4,Consumer Discretionary,"Media, Entertainment & Publication","Incorporated in 2006, Pramara Promotions Ltd
is in the business of promotional merchandise[1]",288.55
RADICO,Radico Khaitan Limited,3060.0,1.64,1.0,19-Sep-25,Equity,40965.0,101,13.3,16.0,Fast Moving Consumer Goods,Fast Moving Consumer Goods,"Incorporated in the year 1943, Radico Khaitan is one of the most recognised IMFL (Indian Made Foreign Liquor) brands in India. [1]
The company was initially known as Rampur Distillery Company and was focussed on distillation and bottling for branded players and canteen stores of armed forces.",2957.6
RAMCOIND,Ramco Industries Limited,390.4,5.05,2.0,19-Sep-25,Equity,3390.0,16.4,4.37,3.61,Commodities,Construction Materials,Part of the Chennai-based Ramco Group; Ramco Industries Ltd. is engaged in the manufacture of Fiber Cement (FC) sheets and Calcium Silicate Boards (CSBs). Company is also engaged in the spinning of cotton yarn; sale of surplus electricity generated from its windmills and computer software.,346.7
RAMCOSYS,Ramco Systems Limited,521.45,-5.0,1.0,19-Sep-25,Equity,1948.0,Book Value,10.9,5.4,Information Technology,Information Technology,"Incorporated in 1997, Ramco Systems
Ltd develops ERP Software solutions,
and provides that with related solutions
and services[1]",520.35
RELTD,Ravindra Energy Limited,184.0,2.53,1.0,19-Sep-25,Equity,3259.0,61.7,10.8,9.53,Industrials,Capital Goods,"Incorporated in 1980, Ravindra Energy Ltd is in the business of selling Solar Pumps, setting up Solar Generation Power Plant (Ground Mount & Rooftop) & generation and sale of Power[1]",165.78
SEJALLTD,Sejal Glass Limited,796.0,1.16,1.0,19-Sep-25,Equity,801.0,57.4,32.6,13.6,Industrials,Capital Goods,"Incorporated in 1998, Sejal Glass Ltd is in the business of value addition of glass & glass products[1]",774.9
